"斣崋","擔晅","柫暱","曐桳斾棪","昡壙妟(墌)","昡壙妟慜擔斾(墌)","昡壙妟慜擔斾棪"
"1","2026/07/05","俰俹儌儖僈儞丒僫僗僟僢僋暷崙姅幃丒僾儗儈傾儉丒僀儞僇儉俤俿俥乮JEPQ乯","0.5497","9572","1","0.0001"
"2","2026/07/05","俵俽倁撪奜俤俿俥帒嶻攝暘僼傽儞僪乮俧僐乕僗乯","0.3383","5890","-37","-0.0062"
"3","2026/07/05","僀儞儀僗僐丂悽奅尩慖姅幃僆乕僾儞亙堊懼僿僢僕側偟亜乮枅寧寛嶼宆乯","0.0619","1078","2","0.0019"
"4","2026/07/05","倕俵俙倃俬俽丂俶倕倧丂僪儘乕儞","0.0215","376","-4","-0.0105"
"5","2026/07/05","倕俵俙倃俬俽丂俽倢倝倣丂暷崙姅幃乮俽仌俹俆侽侽乯","0.0183","319","-3","-0.0093"
"6","2026/07/05","僯僢僙僀俽俷倃巜悢僀儞僨僢僋僗僼傽儞僪乮暷崙敿摫懱姅乯亙峸擖丒姺嬥庤悢椏側偟亜","0.0078","136","-9","-0.0621"
"7","2026/07/05","倕俵俙倃俬俽丂俽倢倝倣丂僶儔儞僗乮俉帒嶻嬒摍宆乯","0.0022","39","0","0"
